{
  "fixture_version": "exploration-fixture/v1",
  "id": "hidden-ranges/identity-without-hidden-ranges",
  "ruleset": "truco-2p-v1",
  "spec": {
    "seed": 23,
    "base_state": {
      "next_dealer": 1,
      "score": { "0": 0, "1": 0 },
      "winner": null,
      "current_hand": {
        "state": {
          "dealer": 1,
          "next_player": 0,
          "score": { "0": 0, "1": 0 },
          "hand_value": 1,
          "turnup": { "rank": "A", "suit": "SPADES" },
          "hands": {
            "0": [
              { "id": "p0c0", "rank": "7", "suit": "DIAMONDS" },
              { "id": "p0c1", "rank": "6", "suit": "CLUBS" },
              { "id": "p0c2", "rank": "4", "suit": "HEARTS" }
            ],
            "1": [
              { "id": "p1c0", "rank": "3", "suit": "CLUBS" },
              { "id": "p1c1", "rank": "5", "suit": "SPADES" },
              { "id": "p1c2", "rank": "4", "suit": "DIAMONDS" }
            ]
          },
          "completed_rounds": [],
          "current_round": {
            "leader": 0,
            "plays": []
          },
          "pending_raise": null,
          "pending_decision": null
        },
        "hand_winner": null,
        "match_winner": null
      }
    }
  },
  "expect_resolved_state": {
    "next_dealer": 1,
    "score": { "0": 0, "1": 0 },
    "winner": null,
    "current_hand": {
      "state": {
        "dealer": 1,
        "next_player": 0,
        "hands": {
          "0": [
            { "id": "p0c0", "rank": "7", "suit": "DIAMONDS" },
            { "id": "p0c1", "rank": "6", "suit": "CLUBS" },
            { "id": "p0c2", "rank": "4", "suit": "HEARTS" }
          ],
          "1": [
            { "id": "p1c0", "rank": "3", "suit": "CLUBS" },
            { "id": "p1c1", "rank": "5", "suit": "SPADES" },
            { "id": "p1c2", "rank": "4", "suit": "DIAMONDS" }
          ]
        }
      }
    }
  }
}
