{
  "fixture_version": "exploration-fixture/v1",
  "id": "nature-nodes/start-fresh-hand-with-exact-turnup",
  "ruleset": "truco-2p-v1",
  "spec": {
    "seed": 41,
    "base_state": {
      "next_dealer": 1,
      "score": { "0": 0, "1": 0 },
      "winner": null,
      "current_hand": null
    },
    "pending_hand": {
      "turnup": { "rank": "A", "suit": "SPADES" }
    }
  },
  "expect_resolved_state": {
    "next_dealer": 1,
    "score": { "0": 0, "1": 0 },
    "winner": null,
    "current_hand": {
      "state": {
        "dealer": 1,
        "next_player": 0,
        "hand_value": 1,
        "turnup": { "rank": "A", "suit": "SPADES" },
        "completed_rounds": [],
        "current_round": {
          "leader": 0,
          "plays": []
        },
        "pending_raise": null,
        "pending_decision": null
      },
      "hand_winner": null,
      "match_winner": null
    }
  }
}
